,Title,Location,Company,Salary,Description,Link,apply Link,date
14,Python Junior Developer,India,FULLSTACK TECHIES,"₹5,00,000 - ₹10,00,000 a year","Experience: 0 to 3 YearsLocation: India40 hours in a week workSalary: 5 Lacs to 10 Lacs INRNo of Positions: 10 NosIndustry: IT-Software / Software ServicesFunctional Area: IT Software – Application Programming, MaintenanceRole Category: Programming & DesignRole: Software DeveloperEmployment Type: Permanent Job, Full TimeWe hire Python Junior Developers with proven track record and elite industry background through a rigorous set of comprehensive screening processes .SCREENING PROCESS:Python Junior DeveloperTechnical Screening : In-depth technical skill review, demonstrated end-to-end involvement in delivery, problem solving skills, analytical thinking, creativity, and shortlist exceptionally result oriented talents.Language & Personality Traits: Conduct internationally approved English language and analytical tests from Cambridge University and qualify candidates. These tests ensure that candidates are able to read, write, and speak English extremely well. Also, the test includes personality traits, and communication skills — one-on-one interview.Mock test cases or projects (Optional for Junior Positions): 2 weeks to 4 weeks of 40 hours of live / mock project is mandatory for candidates to qualify before deploying on a Customer live project. At this screening process, candidates need to demonstrate their in-depth technical competence, professionalism, and integrity.If you’re a Python Junior Developer and no longer wanted to work as a typical employee in the investor vested service industry – with exceptional technical skills – yes, you are in the right place and the right candidate to explore FULLSTACK TECHIES.KEY VALUE PROPOSITION:Python Junior DeveloperYou will be eligible for 2 to 3 times of your current salary/emoluments if you are a qualified FULLSTACK DEVELOPER20 hours per week / 40 hours per week work options available and can be remote position that can be done from anywhere in the world.FULLSTACK TECHIES serve growing companies – small, medium and large enterprises — across and world, and this role is crucial as a Python Junior Developer.JOB DESCRIPTION:Python Junior DeveloperWe are looking for Python Junior Developers– Python developers who will be trained to develop and support web applications. The main scope of the project will include everything from back-end to client-side code, using optimal and efficient technologies, frameworks, and patterns. As a Python Junior Developer, your primary responsibilities will be support – design and develop, maintain and enhance applications. Therefore, it’s essential that – as a Python Junior Developer — you are trained at problem solving, solution design, logical thinking and high-quality coding.RESPONSIBILITIES:Python Junior Developer:Willing to learn and support in delivering high-quality applicationInvolve in integrating with front-end developersHelp writing test-backed server-side codeAnalyzing requirements and designing new functionalitySupporting and fixing existing functionalityInvolve in designing and building application layersPRIMARY SKILLS:Python Junior Developer – Trained OR Willing to learnPythonDjangoREACTNODEExpressPythonScriptHTMLCSSDatabase optimizationAWS – EC2, RDS, SES, S3Familiarity with Agile Methodology, Test-Driven Development and software design patternsREQUIREMENTS:Python Junior DeveloperPositive attitude and excellent communication skillsOutstanding written skillsYou must be comfortable with technology systems and FULLSTACK TECHIES internal toolsConsistent focus to make stake holders experience delightful with the help of your deliverable and FULLSTACK TECHIES value proposition.A solid grasp of solution-centered approach.Must be a well-organized, composed, self-motivated world-class individual contributor or thriving to become so.Collaborative in nature and ability to leverage FULLSTACK TECHIES coders, developers, SME’s, CoE’s and leadership team to deliver outstanding results to End-Customer.FULLSTACK Techies, a part of Outsourcing Service Provider Inc. USA, started its operations in 2012 and have successfully delivered IT transformation projects for small, medium and enterprise customers across the world. We focus on serving companies for their challenging key projects which require supreme attention. FULLSTACK TECHIES consists of the top 10% of IT developers all over the world. Technical talents including Digital IT, Software engineering, Design & Digital Marketing professionals. FULLSTACK TECHIES was created by a group of full stack techies. With entrepreneurial spirit and passion to serve growing companies, a group of highly-skilled and experienced techies joined their hands together.Outsource Bigdata27 days agoReport job",https://in.indeed.com/jobs?q=python+developer&start=0,https://in.indeed.com/rc/clk?jk=1f500cc1686d05c5&from=vj&mvj=0&vjfrom=vjs&pos=bottom&astse=ceb61147c6b6c9ab&assa=6816,27 days ago
15,Python Developer Intern,Remote,RannLab Technologies,None,"ResponsibilitiesWrite effective, scalable codeDevelop back-end components to improve responsiveness and overall performanceIntegrate user-facing elements into applicationsTest and debug programsImprove functionality of existing systemsImplement security and data protection solutionsAssess and prioritize feature requestsCoordinate with internal teams to understand user requirements and provide technical solutionsRequirementsWork experience as a Python DeveloperExpertise in at least one popular Python framework (like Django, Flask or Pyramid)Knowledge of object-relational mapping (ORM)Familiarity with front-end technologies (like JavaScript and HTML5)Team spiritGood problem-solving skillsBSc in Computer Science, Engineering or relevant fieldMinimum Experience RequiredFor Freshers: 3 Months Training in Well Known Institute or Min 2 Months Work Experience or InternshipJob DesignationTrainee/InternSelection ProcessWritten Test/Online TestTechnical TaskTechnical InterviewHR InterviewAcademic RequirementsB.E / B. Tech, BCA, MCA in Computer Science, Engineering or a related field70% throughout AcademicsThe candidate did an Internship during his/her academicsThe candidate did a project during his/her academicsRemunerationStipends depend on the performanceBond: – Min 45 Working DaysJob Location: – Greater Noida/Noida/Work from HomeNotice Period: 7 Working DaysJob Category: DeveloperJob Type: InternJob Location: Work from HomeBond: YesJoining: ImmediateNotice Period: 7 Days30+ days agoReport job",https://in.indeed.com/jobs?q=python+developer&start=10,https://in.indeed.com/rc/clk?jk=44d301994651ed77&from=vj&mvj=0&vjfrom=vjs&pos=bottom&astse=bdd52c0b31148ede&assa=9738,30+ days ago
16,Trainee - freshers - Internship - python-python Developer -...,"Bengaluru, Karnataka",Shri TirupatiI Balaji Education Foundation,"₹3,60,000 - ₹5,90,000 a year","Candidate need to be fresher.Must be graduate in any field.Online Internship in PythonDuration- 3-6 monthsBenefit - 6 months Internship Certificate + Training +JobCall- 8755903284, 73028162440.00-5.00 YearsBachelor Of Technology (B.Tech/B.E)Monster IN22 days agoReport job",https://in.indeed.com/jobs?q=python+developer&start=10,https://in.indeed.com/rc/clk?jk=24d0b8af9148ce96&from=vj&mvj=0&vjfrom=vjs&pos=bottom&astse=9ded9a6fe8785359&assa=2257,22 days ago
17,Python Full Stack Developer,Remote,"Kaleidoscope Business Solutions, Inc","₹1,80,000 - ₹3,18,959 a year","Urgently hiringDo apply if you meet most of the following requirements :*2 + Years of experience in Python Full Stack Development/Programming Experience.Exposure/knowledge in at least one popular Python framework (like Django, Flask or Pyramid)SQL Databases - MariaDB/Postgresql/ TimeSeriesDBNoSQL Databases - MongoDB.Knowledge of search engine such as, Elasticsearch will be a plusKnowledge of In-memory database - Redis will be a plusFluency with a version control system - GitUnit testing & Code Coverage tools such as, PyTest & CoverageGood foundation in software design principles such as, OOP, DRY & SOLID will be a plusData Modeling experience / knowledge will be a plusKnowledge of Design Patterns, data structures, algorithms, and designing for performance, scalability, and availability will be a plusExperience with micro services architecture would be a plus.Familiarity with REST API and ORM (Object Relational Mapper) libraries.Able to integrate multiple data sources and databases into one system.Understanding of the threading limitations of Python, and multi-process architecture.Good understanding of server-side templating languages such as Jinja 2, Mako, etc.Good understanding of front-end technologies, such as JavaScript, HTML5, and CSS3.Knowledge of user authentication and authorization between multiple systems, servers, and environments.Understanding of fundamental design principles behind a scalable application.Familiarity with event-driven programming in Python.Understanding of the differences between multiple delivery platforms, such as mobile vs desktop, and optimizing output to match the specific platform.Sharp problem solving skills and ability to resolve ambiguous requirements.Strong sense of ownership and drive.Excellent communication skills, both written and verbal.Ability to learn new technologies.Coordinate with internal teams to understand user requirements and provide technical solutions.Understanding of accessibility and security compliance.*Job Types: Full-time, Part-time, Regular / Permanent, Contractual / TemporarySalary: ₹180,000.00 - ₹318,959.00 per yearSupplemental Pay:Performance bonusYearly bonusCOVID-19 considerations:Remote Online Interviews3 days agoReport job",https://in.indeed.com/jobs?q=python+developer&start=10,Default Indeed Apply,3 days ago
18,Python/Django Developer,"Kochi, Kerala",Rawdata Technologies,"₹25,000 a month","Urgently hiringJob ResponsibilitiesImplement and maintain Django-based applicationsUse server-side logic to integrate user-facing elements.Write and implement software solutions that integrate different systems.Identify and suggest various opportunities to improve efficiency and functionality.Coordinating the workflow between the graphic designer, the HTML coder, and yourselfCreating self-contained, reusable, and testable modules and componentsContinuously discover, evaluate, and implement new technologies to maximize development efficiency.Unit-test code for robustness, including edge cases, usability, and general reliability.Mentor and lead junior developersRequired Skills3+ years of experience in software industryMinimum 2 year experience in PythonMinimum 2 Year experience in DjangoA good understanding of Django REST FrameworkBasic understanding of front end technologies like HTML, CSS, JavaScript and jQueryAbility to build user interfaces using the latest web standardsFamiliarity with event-driven programming in PythonAble to create database schemas that represent and support business processesStrong unit test and debugging skillsExperience working in LinuxExcellent problem solving skillsExcellent verbal and written communication skillsAbility to work well in a team development environmentExpected Start Date: 15/2/2021Job Type: Full-timeSalary: From ₹25,000.00 per monthBenefits:Life insuranceSchedule:Day shiftFlexible shiftSupplemental Pay:Yearly bonusExperience:total: 3 years (Required)Python/Django: 3 years (Required)Education:Bachelor's (Preferred)Work Remotely:Temporarily due to COVID-193 days agoReport job",https://in.indeed.com/jobs?q=python+developer&start=10,Default Indeed Apply,3 days ago
19,Python/Django Developer,"Kurnool, Andhra Pradesh",Python Developer,"₹15,000 - ₹25,000 a month","Job SummaryPublished on : 14 days agoVacancy : 8Employment Status : Full TimeExperience : 0 - 2 YrsSalary : 15000-25000Interview Venue : KURNOOL#Job DescriptionDjango/flask framework project development experience.Create functions for data calculation (arithmetic functions with conditions)Engage and be actively involved in customer requirementsPerform assigned daily tasks and respond immediately to issues/problemsInvolve in unit/integration testing frameworks and practicesDesign, Implement and Interacting with databasesMaintain and troubleshoot complex systemsWork in SCRUM / Agile environmentJob Type: Full-timeBenefits:Flexible schedulePaid sick timePaid time offSchedule:Day shiftExperience:work: 0-2 year (Preferred)Python: 0-2 year (Preferred)WHATSAPP YOUR CV ON 72-S2-98-32-63 HR TEAMSkillsDjango framework , Python Scripting , Odoo Development , PostgreSQL , Python ,QualificationsMaster in Software EngineeringJobsOmega30+ days agoReport job",https://in.indeed.com/jobs?q=python+developer&start=10,https://in.indeed.com/rc/clk?jk=a0eb558ba11d61a2&from=vj&mvj=0&vjfrom=vjs&pos=bottom&astse=00ff0e7fc0073a82&assa=6654,30+ days ago
20,Python Developer,"Ahmedabad, Gujarat",TX Labs,"₹40,000 a month","We are looking for a Python Developer to join our team and help us develop and maintain various software products. Python Developer responsibilities include writing and testing code, debugging programs and integrating applications with third-party web services. To be successful in this role, you should have experience using server-side logic and work well in a team. Ultimately, you’ll build highly responsive web applications that align with our business needs. Responsibilities :Write effective, scalable codeDevelop back-end components to improve responsiveness and overall performanceIntegrate user-facing elements into applicationsTest and debug programsImprove functionality of existing systemsImplement security and data protection solutionsAssess and prioritize feature requestsCoordinate with internal teams to understand user requirements and provide technical solutions Requirements :Work experience as a Python DeveloperExpertise in at least one popular Python framework (like Django, Flask or Pyramid)Knowledge of object-relational mapping (ORM)Familiarity with front-end technologies (like JavaScript and HTML5)Team spiritGood problem-solving skillsJob Type: Full-timePay: Up to ₹40,000.00 per monthBenefits:Flexible schedulePaid sick timeSchedule:Day shiftExperience:Django: 1 year (Preferred)flask: 1 year (Preferred)python: 1 year (Preferred)Education:Bachelor's (Preferred)Speak with the employer+91 9316749089TodayReport job",https://in.indeed.com/jobs?q=python+developer&start=10,Default Indeed Apply,Today
21,Hiring Python-Django with postgresql (Backend developer),"Gurgaon, Haryana",HRinnovations,"₹15,000 - ₹20,000 a month","Hiring candidates for Python-Django backend developer.Minimum 1+ year experience requiredLocation-Gurgaonkindly call/whatsapp on 9769460342Job Type: Full-timeSalary: ₹15,000.00 - ₹20,000.00 per monthSchedule:Morning shiftExperience:Programming: 1 year (Preferred)work: 1 year (Preferred)total work: 1 year (Preferred)Education:Secondary(10th Pass) (Preferred)Speak with the employer+91 9769460342Just postedReport job",https://in.indeed.com/jobs?q=python+developer&start=10,Default Indeed Apply,Just posted
22,Python/Odoo Developer,"Pune, Maharashtra",TechSpawn Solutions,"₹3,00,000 - ₹8,00,000 a year","Urgently hiringPython / Odoo DeveloperJob Summary:We are currently recruiting for the Python/Odoo(OpenERP) Developer position in our company.This position will be responsible for developing and supporting enhancements to Odoo(OpenERP) modules, customer projects and their related integrations.The candidate should be able to work with functional business analysts, business process owners, and other technical team members for a given requirement or process, capable of executing requirement and design specification into development deliverable.Roles & Responsibilities: -Design, Development and testing of Odoo(OpenERP) addons, projects, products and interfaces.Interact with customers and provide guidance with Odoo(OpenERP) modules functionality.Ability to write maintainable application code that effectively and efficiently implements business requirements.Work with fellow developers to provide on-time and complete features, documentation and peer training.Participate in all phases of the Agile software development life cycle including technical analysis, design, development, testing, documentation, and deployment. -Studying and distributing help documents related to customizations, designs, and reports.He also looks into complex matters and decides the correct curative action.Reviewing codes and providing assistance to group members who have very little expertise.Taking part in the development of long reach strategies and aims. Enforcing architectural procedures for projects.Creating and making architecture and technical documents up to date for follow up and approval.Keeping himself up to date with the latest Odoo(OpenERP) versions.Listing all functional, technical, and operational data necessary for preparation.Required Experience, Skills, and QualificationsBachelors or Masters degree in Computer Science/Engineering (B.Tech/M.Tech/MCA).Strong 2+ years of experience in Odoo(OpenERP) Installation, Configuration, Customization, Development, Integration, and Migration.Sound knowledge of Python programming language.Broad knowledge of core technical areas of the business and accompanying functional modules of Odoo(OpenERP).Experience integrating Odoo(OpenERP) modules with various formats including flat-file (CSV), XML, and XML-RPC.Knowledge of core ERP components Customer Relationship Management, Supply Chain Management, Manufacturing Resource Planning, Human Resource Management, Project Resource Management and Finance Resource Management.""Hands-On experience with PL/SQL, Workflow and Python scripting.Ability to work with and enhance complex, highly integrated enterprise applications.Self-starter with a can-do attitude a must in a fast-paced business and technical environment.Ability to develop technical solutions to business requirements in complex projects, products, and modules environment. -Ability to learn and apply new trends and tecExpected Start Date: 1/2/2021Job Type: Full-timeSalary: ₹300,000.00 - ₹800,000.00 per yearBenefits:Flexible scheduleHealth insuranceWork from homeSchedule:Day shiftEvening shiftSupplemental Pay:Quarterly bonusYearly bonusExperience:work: 2 years (Preferred)total work: 2 years (Preferred)Odoo: 2 years (Preferred)Education:Bachelor's (Preferred)Speak with the employer+91 968968997514 days agoReport job",https://in.indeed.com/jobs?q=python+developer&start=10,Default Indeed Apply,14 days ago
23,Python Junior Developer,India,FULLSTACK TECHIES,"₹5,00,000 - ₹10,00,000 a year","Experience: 0 to 3 YearsLocation: India40 hours in a week workSalary: 5 Lacs to 10 Lacs INRNo of Positions: 10 NosIndustry: IT-Software / Software ServicesFunctional Area: IT Software – Application Programming, MaintenanceRole Category: Programming & DesignRole: Software DeveloperEmployment Type: Permanent Job, Full TimeWe hire Python Junior Developers with proven track record and elite industry background through a rigorous set of comprehensive screening processes .SCREENING PROCESS:Python Junior DeveloperTechnical Screening : In-depth technical skill review, demonstrated end-to-end involvement in delivery, problem solving skills, analytical thinking, creativity, and shortlist exceptionally result oriented talents.Language & Personality Traits: Conduct internationally approved English language and analytical tests from Cambridge University and qualify candidates. These tests ensure that candidates are able to read, write, and speak English extremely well. Also, the test includes personality traits, and communication skills — one-on-one interview.Mock test cases or projects (Optional for Junior Positions): 2 weeks to 4 weeks of 40 hours of live / mock project is mandatory for candidates to qualify before deploying on a Customer live project. At this screening process, candidates need to demonstrate their in-depth technical competence, professionalism, and integrity.If you’re a Python Junior Developer and no longer wanted to work as a typical employee in the investor vested service industry – with exceptional technical skills – yes, you are in the right place and the right candidate to explore FULLSTACK TECHIES.KEY VALUE PROPOSITION:Python Junior DeveloperYou will be eligible for 2 to 3 times of your current salary/emoluments if you are a qualified FULLSTACK DEVELOPER20 hours per week / 40 hours per week work options available and can be remote position that can be done from anywhere in the world.FULLSTACK TECHIES serve growing companies – small, medium and large enterprises — across and world, and this role is crucial as a Python Junior Developer.JOB DESCRIPTION:Python Junior DeveloperWe are looking for Python Junior Developers– Python developers who will be trained to develop and support web applications. The main scope of the project will include everything from back-end to client-side code, using optimal and efficient technologies, frameworks, and patterns. As a Python Junior Developer, your primary responsibilities will be support – design and develop, maintain and enhance applications. Therefore, it’s essential that – as a Python Junior Developer — you are trained at problem solving, solution design, logical thinking and high-quality coding.RESPONSIBILITIES:Python Junior Developer:Willing to learn and support in delivering high-quality applicationInvolve in integrating with front-end developersHelp writing test-backed server-side codeAnalyzing requirements and designing new functionalitySupporting and fixing existing functionalityInvolve in designing and building application layersPRIMARY SKILLS:Python Junior Developer – Trained OR Willing to learnPythonDjangoREACTNODEExpressPythonScriptHTMLCSSDatabase optimizationAWS – EC2, RDS, SES, S3Familiarity with Agile Methodology, Test-Driven Development and software design patternsREQUIREMENTS:Python Junior DeveloperPositive attitude and excellent communication skillsOutstanding written skillsYou must be comfortable with technology systems and FULLSTACK TECHIES internal toolsConsistent focus to make stake holders experience delightful with the help of your deliverable and FULLSTACK TECHIES value proposition.A solid grasp of solution-centered approach.Must be a well-organized, composed, self-motivated world-class individual contributor or thriving to become so.Collaborative in nature and ability to leverage FULLSTACK TECHIES coders, developers, SME’s, CoE’s and leadership team to deliver outstanding results to End-Customer.FULLSTACK Techies, a part of Outsourcing Service Provider Inc. USA, started its operations in 2012 and have successfully delivered IT transformation projects for small, medium and enterprise customers across the world. We focus on serving companies for their challenging key projects which require supreme attention. FULLSTACK TECHIES consists of the top 10% of IT developers all over the world. Technical talents including Digital IT, Software engineering, Design & Digital Marketing professionals. FULLSTACK TECHIES was created by a group of full stack techies. With entrepreneurial spirit and passion to serve growing companies, a group of highly-skilled and experienced techies joined their hands together.Outsource Bigdata27 days agoReport job",https://in.indeed.com/jobs?q=python+developer&start=10,https://in.indeed.com/rc/clk?jk=1f500cc1686d05c5&from=vj&mvj=0&vjfrom=vjs&pos=bottom&astse=3066c74996ac26ea&assa=7636,27 days ago
24,Python Developer,"Noida, Uttar Pradesh",Bluethink IT Consulting Pvt Ltd,"₹18,708 - ₹30,000 a month","· Work experience as a Python Developer for at least 2-3 years.· Expertise in at least one popular Python framework (like Django, Flask).· Knowledge of object-relational mapping (ORM).· Experience using Pycharm and visual studio.· Familiarity with front-end technologies (like JavaScript and HTML5).· Team spirit.Good problem-solving skillsJob Type: Full-timeSalary: ₹18,708.00 - ₹30,000.00 per monthBenefits:Commuter assistancePaid sick timePaid time offSchedule:Day shiftMonday to FridaySupplemental Pay:Overtime payPerformance bonusYearly bonusCOVID-19 Precaution(s):Remote interview processVirtual meetings4 days agoReport job",https://in.indeed.com/jobs?q=python+developer&start=10,Default Indeed Apply,4 days ago
